0,1,2
,University Campuses,
Chiniot-Faisalabad Campus,,
S,ituated at the junction of Pakistan’s Textile Capital-Faisalabad and the historically rich city,
"of Chiniot in suburbs of River Chenab, the Chiniot - Faisalabad campus is the 5th campus",,
of  the  university.  The  campus  symbolizes  the  desirable  connection  between  nature  and,,
industry and between tradition and modernity. Its picturesque surroundings in the outskirts,,
"of Pakistan’s Manchester, the home to the textile industry, represent human advancement",,
from agrarian to industrial and technological society. Spanning around 30 acres along the,,
"Faisalabad Sargodha Road, approximately 9 kilometers from the M4 Motorway interchange",,
"towards Chiniot, this campus is a testament to academic excellence in both professional and",,
"personal realms. Following in the footsteps of its esteemed sister campuses in Islamabad,",,
"Lahore, Karachi, and Peshawar, graduates here are highly sought after by both national and",,
"multinational corporations, with many holding prominent positions in renowned institutions",,
"like Google, Facebook, and Microsoft.",,
F,AST-NUCES Chiniot-Faisalabad is the first residential campus of the University offering,
Boys and Girls Hostel and allied facilities inside the campus. The campus is home to 1000+,,
"boys  and  girls  residing  in  campus.  Offering  programs  in  Computer  Science,  Software",,
"Engineering, Artificial Intelligence, Electrical Engineering, and Business Administration,",,
the campus boasts a distinguished faculty dedicated to nurturing academic excellence. State-,,
"of-the-art facilities, including advanced computing and engineering labs, provide students",,
with hands-on experience and a conducive learning environment.,,
M,"oreover, the campus has catalyzed Faisalabad's technological landscape, fostering a surge",
in technology startups. Its strategic proximity to leading industrial enterprises promises to,,
"elevate  the  standard  of  professional  education  across  the  nation.  Beyond  academics,  the",,
campus  fosters  a  vibrant  student,"life,  fostering  holistic  development","through  sports,"
"competitions, and cultural events. From cricket to chess, students engage in a diverse array",,
of  activities  that  enrich  their  collegiate  experience.  The  campus  has  state  of  the  art,,
"computing, engineering and other support facilities. Spacious and well-equipped computer",,
and engineering labs impart practical orientation to the students in their respective areas of,,
"study.  Audio-visually 
supported","and  well-furnished 
classrooms  offer","a 
favorable,"
"conducive, and constructive learning environment to the students.",,
T,he Campus other than academics offer a very vibrant student life to contribute towards the,
personality development of the students. Extends sports facilities in both indoor and outdoor,,
"games  like  cricket,  football,  badminton,  table  tennis,  volleyball,  basketball,  futsal,  and",,
"chess. Besides sports, healthy competitions in the fields of information technology, business",,
and arts are frequently organized by the campus.,,
